{
  "schema_version": "1.0",
  "site_policy_id": "lab-bd-pair-v1",
  "environment": "lab",
  "production_eligible": false,
  "qfx_pair": [
    {
      "role": "qfx-a",
      "management_address": "10.255.3.14",
      "expected_hostname": "BD-1",
      "expected_model": "ptx10001-36mr"
    },
    {
      "role": "qfx-b",
      "management_address": "10.255.3.15",
      "expected_hostname": "BD-2",
      "expected_model": "ptx10001-36mr"
    }
  ],
  "stage_port_pools": {
    "lab-established": [
      "et-0/0/3",
      "et-0/0/4",
      "et-0/0/5"
    ]
  },
  "excluded_interfaces": [],
  "management_vlan": {
    "name": "MGMT",
    "vlan_id": 163
  },
  "temporary_recovery_vlan": {
    "name": "TEMP-RECOVERY",
    "vlan_id": 3999
  },
  "port_to_ae": {
    "method": "explicit-migration-id-map",
    "ae_min": 0,
    "ae_max": 2,
    "assignments": [
      {
        "migration_id": "dh4301",
        "physical_interface": "et-0/0/3",
        "ae_interface": "ae0"
      },
      {
        "migration_id": "nh5302",
        "physical_interface": "et-0/0/4",
        "ae_interface": "ae1"
      },
      {
        "migration_id": "sw1203",
        "physical_interface": "et-0/0/5",
        "ae_interface": "ae2"
      }
    ]
  },
  "esi": {
    "method": "auto-derive-type-1-lacp",
    "all_active": true
  },
  "lacp_system_id": {
    "method": "explicit-per-ae",
    "values": {
      "ae0": "00:01:02:03:04:00",
      "ae1": "00:01:02:03:04:01",
      "ae2": "00:01:02:03:04:02"
    }
  },
  "validation": {
    "require_interface_symmetry": true,
    "require_lldp": true,
    "require_lacp_partner": true,
    "require_matching_lacp_system_id": true,
    "operator_supplied_ports_allowed": false
  }
}
